B1: bodování listopad
B3: do bodování za øíjen e zapoèteno: (celkem možno získat 270 b)
B4: : schùzky maximálnì 100b.
B5: : oddílovka (max. 35 ), telocvièna (max.35 ), výprava s rodièi ( max 45.b)
B6: : oddílovka, tìlocvièna (25%+ 25%) výprava s rodièi (50%)
B8: pøezdívka | C8: jméno pøíjmení | D8: schùzky | E8: oddílovka | F8: tìlocvièna | G8: výprava | H8: CELKEM | I8: docházka oddíl.+výpravy | J8: docházka.schùzky | K8: šestka | L8: odmìnové body z 9
A9: 1 | B9: hruška | C9: míša kaderová | D9: 92 | E9: 30 | F9: 35 | G9: 45 | H9: =D9+E9+F9+G9 -> 202 | I9: 100 | J9: 1 | K9: modrá | L9: 9
A10: 2 | B10: mici | C10: patricie dolanská | D10: 96 | E10: 35 | F10: 35 | G10: 35 | H10: =D10+E10+F10+G10 -> 201 | I10: 100 | J10: 1 | K10: fialová | L10: 9
A11: 3 | B11: mrazík | C11: tomáš roud | D11: 84 | E11: 30 | F11: 32 | G11: 45 | H11: =D11+E11+F11+G11 -> 191 | I11: 100 | J11: 1 | K11: èerná | L11: 9
A12: 4 | B12: bibi | C12: bára seifertová | D12: 82 | E12: 30 | F12: 35 | G12: 40 | H12: =D12+E12+F12+G12 -> 187 | I12: 100 | J12: 1 | K12: èervená | L12: 9
A13: 5 | B13: copánek | C13: mariana žïárková | D13: 72 | E13: 30 | F13: 35 | G13: 40 | H13: =D13+E13+F13+G13 -> 177 | I13: 75 | J13: 1 | K13: èervená | L13: 8
A14: 6 | B14: rùžièka | C14: veronika aichengrová | D14: 73 | E14: 30 | F14: 35 | G14: 35 | H14: =D14+E14+F14+G14 -> 173 | I14: 75 | J14: 1 | K14: fialová | L14: 8
A15: 7 | B15: piškot | C15: matìj smutný | D15: 72 | E15: 30 | F15: 35 | G15: 35 | H15: =D15+E15+F15+G15 -> 172 | I15: 100 | J15: 1 | K15: hnìdá | L15: 9
A16: 8 | B16: malina | C16: klára spilková | D16: 70 | E16: 30 | F16: 35 | G16: 35 | H16: =D16+E16+F16+G16 -> 170 | I16: 75 | J16: 1 | K16: modrá | L16: 8
A17: 9 | B17: myška | C17: andrea švarcová | D17: 100 | E17: 30 | F17: 35 | G17: 0 | H17: =D17+E17+F17+G17 -> 165 | I17: 100 | J17: 0.5 | K17: fialová | L17: 6
A18: 10 | B18: rychlík | C18: Matìj Spìváèek | D18: 68 | E18: 25 | F18: 35 | G18: 35 | H18: =D18+E18+F18+G18 -> 163 | I18: 1 | J18: 1 | K18: zelená | L18: 8
A19: 11 | B19: Èimèár | C19: vojta kostifál | D19: 68 | E19: 30 | F19: 32 | G19: 10 | H19: =D19+E19+F19+G19 -> 140 | I19: 1 | J19: 0.5 | K19: zelená | L19: 5
A20: 12.-13 | B20: krokodýl | C20: vojta janda | D20: 65 | E20: 30 | F20: 35 | G20: 0 | H20: =D20+E20+F20+G20 -> 130 | I20: 100 | J20: 0.5 | K20: hnìdá | L20: 6
A21: 12.-13 | B21: Èaryzárd | C21: marek jandoš | D21: 70 | E21: 25 | F21: 35 | G21: 0 | H21: =D21+E21+F21+G21 -> 130 | I21: 1 | J21: 0.5 | K21: zelená | L21: 5
A22: 14 | B22: brzda | C22: adam kobes | D22: 38 | E22: 25 | F22: 30 | G22: 35 | H22: =D22+E22+F22+G22 -> 128 | I22: 50 | J22: 1 | K22: èerná | L22: 7
A23: 15.-16 | B23: høíbì | D23: 52 | E23: 35 | F23: 35 | G23: 0 | H23: =D23+E23+F23+G23 -> 122 | I23: 50 | J23: 0.5 | K23: fialová | L23: 4
A24: 15.-16 | B24: nanuk | C24: jan kotrlík | D24: 62 | E24: 25 | F24: 35 | G24: 0 | H24: =D24+E24+F24+G24 -> 122 | I24: 75 | J24: 0.5 | K24: hnìdá | L24: 5
A25: 17.-18 | B25: kachnièka | C25: valinka marušincová | D25: 31 | E25: 25 | F25: 30 | G25: 35 | H25: =D25+E25+F25+G25 -> 121 | I25: 25 | J25: 1 | K25: èervená | L25: 6
A26: 17.-18 | B26: lev | C26: Daník Budweiser | D26: 69 | E26: 25 | F26: 27 | G26: 0 | H26: =D26+E26+F26+G26 -> 121 | I26: 1 | J26: 0.5 | K26: zelená | L26: 5
A27: 19.-20 | B27: ségra | C27: markéta roubová | D27: 78 | E27: 30 | F27: 10 | G27: 0 | H27: =D27+E27+F27+G27 -> 118 | I27: 75 | J27: 0.25 | K27: fialová | L27: 4
A28: 19.-20 | B28: štìnì | C28: adélka domanská | D28: 58 | E28: 30 | F28: 30 | G28: 0 | H28: =D28+E28+F28+G28 -> 118 | I28: 50 | J28: 0.5 | K28: modrá | L28: 4
A29: 21 | B29: riki | C29: nina petkinsová | D29: 57 | E29: 25 | F29: 35 | G29: 0 | H29: =D29+E29+F29+G29 -> 117 | I29: 75 | J29: 0.5 | K29: modrá | L29: 5
A30: 22 | B30: vlk | C30: šimon kurz | D30: 70 | E30: 35 | F30: 0 | G30: 0 | H30: =D30+E30+F30+G30 -> 105 | I30: 100 | J30: 0.25 | K30: hnìdá | L30: 5
A31: 23 | B31: sirka | C31: ondra zahradník | D31: 34 | E31: 35 | F31: 35 | G31: 0 | H31: =D31+E31+F31+G31 -> 104 | I31: 50 | J31: 0.5 | K31: èerná | L31: 4
A32: 24.-25 | B32: rex | C32: jan jindáèek | D32: 46 | E32: 10 | F32: 10 | G32: 35 | H32: =D32+E32+F32+G32 -> 101 | I32: 50 | J32: 0.5 | K32: èerná | L32: 5
A33: 24.-25 | B33: lízátko | C33: dianka marušincová | D33: 46 | E33: 10 | F33: 10 | G33: 35 | H33: =D33+E33+F33+G33 -> 101 | I33: 50 | J33: 0.5 | K33: modrá | L33: 5
A34: 26 | B34: Vojta | C34: Vojta suchánek | D34: 53 | E34: 0 | F34: 0 | G34: 45 | H34: =D34+E34+F34+G34 -> 98 | I34: 1 | J34: 0.5 | K34: zelená | L34: 6
A35: 27 | B35: kuba- hnízdo | C35: kuba | D35: 40 | E35: 25 | F35: 32 | G35: 0 | H35: =D35+E35+F35+G35 -> 97 | I35: 50 | J35: 0.5 | K35: èerná | L35: 4
A36: 28 | B36: klíštì | C36: jan smitka | D36: 30 | E36: 35 | F36: 30 | G36: 0 | H36: =D36+E36+F36+G36 -> 95 | I36: 25 | J36: 0.5 | K36: hnìdá | L36: 3
A37: 29 | B37: lišák | C37: šimon janoušek | D37: 32 | E37: 10 | F37: 30 | G37: 10 | H37: =D37+E37+F37+G37 -> 82 | I37: 25 | J37: 0.25 | K37: hnìdá | L37: 2
A38: 30 | B38: motýlek | C38: terezka roschová | D38: 25 | E38: 30 | F38: 25 | G38: 0 | H38: =D38+E38+F38+G38 -> 80 | I38: 25 | J38: 0.5 | K38: fialová | L38: 3
A39: 31 | B39: veverka | C39: lenka macháèková | D39: 77 | E39: 0 | F39: 0 | G39: 0 | H39: =D39+E39+F39+G39 -> 77 | I39: 75 | J39: 0 | K39: fialová | L39: 3
A40: 32 | B40: ocásek | C40: ema kobesová | D40: 8 | E40: 30 | F40: 35 | G40: 0 | H40: =D40+E40+F40+G40 -> 73 | I40: 0 | J40: 0.5 | K40: modrá | L40: 2
A41: 33.-34 | B41: emsí | C41: fanda faist | D41: 13 | E41: 25 | F41: 32 | G41: 0 | H41: =D41+E41+F41+G41 -> 70 | I41: 25 | J41: 0.5 | K41: èerná | L41: 3
A42: 33.-34 | B42: mikeš | C42: jan miksan | D42: 35 | E42: 0 | F42: 35 | G42: 0 | H42: =D42+E42+F42+G42 -> 70 | I42: 50 | J42: 0.25 | K42: èerná | L42: 3
A43: 35 | B43: šiška | C43: hana trambová | D43: 55 | E43: 0 | F43: 0 | G43: 10 | H43: =D43+E43+F43+G43 -> 65 | I43: 50 | J43: 0 | K43: èervená | L43: 2
A44: 36.-39 | B44: vlnka | C44: viktorie bechná | D44: 32 | E44: 10 | F44: 10 | G44: 10 | H44: =D44+E44+F44+G44 -> 62 | I44: 25 | J44: 0 | K44: èervená | L44: 1
A45: 36.-39 | B45: oveèka | C45: berenika bechná | D45: 32 | E45: 10 | F45: 10 | G45: 10 | H45: =D45+E45+F45+G45 -> 62 | I45: 25 | J45: 0 | K45: modrá | L45: 1
A46: 36.-39 | B46: ondra | C46: ondra pták | D46: 62 | E46: 0 | F46: 0 | G46: 0 | H46: =D46+E46+F46+G46 -> 62 | I46: 1 | J46: 0 | K46: zelená | L46: 3
A47: 39 | B47: vèela | C47: kristýna gothardová | D47: 48 | E47: 10 | F47: 0 | G47: 0 | H47: =D47+E47+F47+G47 -> 58 | I47: 50 | J47: 0 | K47: modrá | L47: 2
A48: 40 | B48: kytièka | C48: eliška ptáková | D48: 57 | E48: 0 | F48: 0 | G48: 0 | H48: =D48+E48+F48+G48 -> 57 | I48: 75 | J48: 0 | K48: èervená | L48: 3
A49: 41 | B49: kiki | C49: kristýna tomášková | D49: 17 | E49: 0 | F49: 35 | G49: 0 | H49: =D49+E49+F49+G49 -> 52 | I49: 25 | J49: 0.25 | K49: fialová | L49: 2
A50: 42 | B50: ještìrka | C50: martina vojtová | D50: 44 | E50: 0 | F50: 0 | G50: 0 | H50: =D50+E50+F50+G50 -> 44 | I50: 50 | J50: 0 | K50: fialová | L50: 2
A51: 43.-44 | B51: kudla | C51: vilík faist | D51: 18 | E51: 25 | F51: 0 | G51: 0 | H51: =D51+E51+F51+G51 -> 43 | I51: 25 | J51: 0.25 | K51: èerná | L51: 2
A52: 43.-44 | B52: viktor | D52: 43 | E52: 0 | F52: 0 | G52: 0 | H52: =D52+E52+F52+G52 -> 43 | I52: 0.66 | J52: 0 | K52: zelená | L52: 2
A53: 45 | B53: bendr | C53: lukáš vraný | D53: 42 | E53: 0 | F53: 0 | G53: 0 | H53: =D53+E53+F53+G53 -> 42 | I53: 50 | J53: 0 | K53: èerná | L53: 2
A54: 46 | B54: koèièka | C54: bára | D54: 40 | E54: 0 | F54: 0 | G54: 0 | H54: =D54+E54+F54+G54 -> 40 | I54: 25 | J54: 0 | K54: èervená | L54: 1
A55: 47 | B55: Honzík | D55: 32 | E55: 0 | F55: 0 | G55: 0 | H55: =D55+E55+F55+G55 -> 32 | I55: 0.33 | J55: 0 | K55: zelená | L55: 1
A56: 48 | B56: tygøík | C56: linda fryèová | D56: 31 | E56: 0 | F56: 0 | G56: 0 | H56: =D56+E56+F56+G56 -> 31 | I56: 25 | J56: 0 | K56: modrá | L56: 1
A57: 49 | B57: Lukáš | C57: Lukáš Fariz | D57: -3 | E57: 0 | F57: 0 | G57: 0 | H57: =D57+E57+F57+G57 -> -3 | I57: 0 | J57: 0 | K57: zelená | L57: 0