B1: bodování záøí (bodovací kartièky dostanou dìti za snahu v záøí na oddílovce 8.10)
B3: do bodování za záøí je zapoèteno: (celkem mono získat 135b)
B4: : schùzky (celkem 3 schùzky, jedna 33%) maximálnì 75b.
B5: : oddílovka 24.9- (vichni 30b) + výprava klubovna 25.9- (vichni 30b) --> (celkem 2 akce, jedna akce 50%)
B6: (Zahajovací oddílovka, Straidelný les, Odpoledne jako hroch jsou "navíc")
B8: pozn. Ke jménùm- pokud je u vaeho dítìte patné/ ádné jméno napite to do vzdazovníku/ lvíèeti
A10: poøadí | B10: pøezdívka | C10: jméno pøíjmení | D10: schùzky | E10: oddílovka | F10: výprava | G10: CELKEM | H10: docházka.schùzky | I10: docházka oddíl.+výpravy | J10: estka
A11: 1. | B11: pikot | C11: matìj smutný | D11: 65 | E11: 30 | F11: 30 | G11: =D11+E11+F11 -> 125 | H11: 1 | I11: 1 | J11: hnìdá
A12: 2. | B12: tìnì | C12: adélka domanská | D12: 62 | E12: 30 | F12: 30 | G12: =D12+E12+F12 -> 122 | H12: 1 | I12: 1 | J12: modro-èervená
A13: 3. | B13: Daník- lev | C13: Daník Budweiser | D13: 60 | E13: 30 | F13: 30 | G13: =D13+E13+F13 -> 120 | H13: 1 | I13: 1 | J13: zelená
A14: 4. | B14: Èaryzárd | D14: 57 | E14: 30 | F14: 30 | G14: =D14+E14+F14 -> 117 | H14: 1 | I14: 1 | J14: zelená
A15: 5. | B15: Vojta | C15: Vojta suchánek | D15: 55 | E15: 30 | F15: 30 | G15: =D15+E15+F15 -> 115 | H15: 1 | I15: 1 | J15: zelená
A16: 6. | B16: Èimèár | D16: 54 | E16: 30 | F16: 30 | G16: =D16+E16+F16 -> 114 | H16: 1 | I16: 1 | J16: zelená
A17: 7. | B17: mája- pipi | C17: mariana ïárková | D17: 51 | E17: 30 | F17: 30 | G17: =D17+E17+F17 -> 111 | H17: 1 | I17: 1 | J17: modro-èervená
A18: 8. | B18: ika | C18: hana trambová | D18: 50 | E18: 30 | F18: 30 | G18: =D18+E18+F18 -> 110 | H18: 1 | I18: 1 | J18: modro-èervená
A19: 9. | B19: bibi | C19: bára feifrtová | D19: 48 | E19: 30 | F19: 30 | G19: =D19+E19+F19 -> 108 | H19: 1 | I19: 1 | J19: modro-èervená
A20: 10. | B20: lízátko | C20: dianka maruincová | D20: 47 | E20: 30 | F20: 30 | G20: =D20+E20+F20 -> 107 | H20: 1 | I20: 1 | J20: modro-èervená
A21: 11. | B21: kachnièka | C21: valinka maruincová | D21: 46 | E21: 30 | F21: 30 | G21: =D21+E21+F21 -> 106 | H21: 1 | I21: 1 | J21: modro-èervená
A22: 12. | B22: hruka | C22: mía kaderová | D22: 43 | E22: 30 | F22: 30 | G22: =D22+E22+F22 -> 103 | H22: 1 | I22: 1 | J22: modro-èervená
A23: 13. | B23: malina | C23: klára spilková | D23: 61 | E23: 30 | F23: 10 | G23: =D23+E23+F23 -> 101 | H23: 1 | I23: 0.5 | J23: modro-èervená
A24: 14. | B24: motýlek | C24: terezka roschová | D24: 38 | E24: 30 | F24: 30 | G24: =D24+E24+F24 -> 98 | H24: 0.66 | I24: 1 | J24: fialová
A25: 15. | B25: veverka | C25: lenka macháèková | D25: 57 | E25: 30 | F25: 10 | G25: =D25+E25+F25 -> 97 | H25: 1 | I25: 0.5 | J25: fialová
A26: 16. | B26: klítì | C26: jan smitka | D26: 35 | E26: 30 | F26: 30 | G26: =D26+E26+F26 -> 95 | H26: 0.66 | I26: 1 | J26: hnìdá
A27: 17. | B27: krokodýl | C27: vojta janda | D27: 34 | E27: 30 | F27: 30 | G27: =D27+E27+F27 -> 94 | H27: 0.66 | I27: 1 | J27: hnìdá
A28: 18. | B28: rex | C28: jan jindáèek | D28: 31 | E28: 30 | F28: 30 | G28: 91 | H28: 0.66 | I28: 1 | J28: èerná
A29: 19. | B29: myka | C29: andrea varcová | D29: 45 | E29: 30 | F29: 10 | G29: =D29+E29+F29 -> 85 | H29: 0.66 | I29: 0.5 | J29: fialová
A30: 20. | B30: riki | C30: nina petkinsová | D30: 53 | E30: 0 | F30: 30 | G30: =D30+E30+F30 -> 83 | H30: 1 | I30: 0.5 | J30: modro-èervená
A31: 21. | B31: mic | C31: patricie dolanská | D31: 42 | E31: 30 | F31: 10 | G31: =D31+E31+F31 -> 82 | H31: 0.66 | I31: 0.5 | J31: fialová
A32: 22.-23 | B32: kuba | C32: kuba | D32: 41 | E32: 30 | F32: 10 | G32: 81 | H32: 1 | I32: 0.5 | J32: èerná
A33: 22.-23 | B33: rùièka | C33: veronika aichengrová | D33: 41 | E33: 30 | F33: 10 | G33: =D33+E33+F33 -> 81 | H33: 0.66 | I33: 0.5 | J33: fialová
A34: 24. | B34: Luká | C34: Luká Fariz | D34: 59 | E34: 10 | F34: 10 | G34: =D34+E34+F34 -> 79 | H34: 1 | I34: 0 | J34: zelená
A35: 25.-27 | B35: tygøík | C35: linda fryèová | D35: 36 | E35: 30 | F35: 10 | G35: =D35+E35+F35 -> 76 | H35: 0.66 | I35: 1 | J35: modro-èervená
A36: 25.-27 | B36: mrazík | C36: tomá roud | D36: 36 | E36: 30 | F36: 10 | G36: 76 | H36: 0.66 | I36: 0.5 | J36: èerná
A37: 25.-27 | B37: ségra | C37: markéta roubová | D37: 36 | E37: 30 | F37: 10 | G37: =D37+E37+F37 -> 76 | H37: 0.66 | I37: 0.5 | J37: fialová
A38: 28. | B38: beruka | C38: kateøina habanská | D38: 34 | E38: 30 | F38: 10 | G38: =D38+E38+F38 -> 74 | H38: 0.66 | I38: 0.5 | J38: fialová
A39: 29.-30 | B39: emsí | C39: fanda faist | D39: 13 | E39: 30 | F39: 30 | G39: 73 | H39: 0.33 | I39: 1 | J39: èerná
A40: 29.-30 | B40: nanuk | C40: jan kotrlík | D40: 33 | E40: 30 | F40: 10 | G40: =D40+E40+F40 -> 73 | H40: 0.66 | I40: 0.5 | J40: hnìdá
A41: 31. | B41: rychlík | C41: dan hrubý | D41: 12 | E41: 30 | F41: 30 | G41: =D41+E41+F41 -> 72 | H41: 0.33 | I41: 1 | J41: hnìdá
A42: 32. | B42: vlk | C42: imon kurz | D42: 34 | E42: 0 | F42: 30 | G42: =D42+E42+F42 -> 64 | H42: 0.66 | I42: 0.5 | J42: hnìdá
A43: 33.-34 | B43: jetìrka | C43: martina vojtová | D43: 61 | E43: 0 | F43: 0 | G43: =D43+E43+F43 -> 61 | H43: 1 | I43: 0 | J43: fialová
A44: 33.-34 | B44: høíbì | C44: adélka buková | D44: 41 | E44: 10 | F44: 10 | G44: =D44+E44+F44 -> 61 | H44: 0.66 | I44: 0 | J44: fialová
A45: 35.-36 | B45: oveèka | C45: berenika bechná | D45: 40 | E45: 10 | F45: 10 | G45: =D45+E45+F45 -> 60 | H45: 0.66 | I45: 0 | J45: modro-èervená
A46: 35.-36 | B46: brzda | C46: adam kobes | D46: 32 | E46: 10 | F46: 10 | G46: 60 | H46: 0.66 | I46: 0 | J46: èerná
A47: 37.-38 | B47: Matìj | C47: Matìj Spìváèek | D47: 56 | E47: 0 | F47: 0 | G47: =D47+E47+F47 -> 56 | H47: 1 | I47: 0 | J47: zelená
A48: 37.-38 | B48: Honzík | D48: 56 | E48: 0 | F48: 0 | G48: =D48+E48+F48 -> 56 | H48: 1 | I48: 0 | J48: zelená
A49: 39.-40 | B49: vlnka | C49: viktorie bechná | D49: 27 | E49: 10 | F49: 10 | G49: =D49+E49+F49 -> 47 | H49: 0.66 | I49: 0 | J49: modro-èervená
A50: 39.-40 | B50: david | C50: david | D50: 47 | E50: 0 | F50: 0 | G50: =D50+E50+F50 -> 47 | H50: 1 | I50: 0 | J50: hnìdá
A51: 41. | B51: býk | C51: jirka leák | D51: 46 | E51: 0 | F51: 0 | G51: =D51+E51+F51 -> 46 | H51: 0.66 | I51: 0 | J51: hnìdá
A52: 42. | B52: vlkodlak | C52: jan mráz | D52: 45 | E52: 0 | F52: 0 | G52: =D52+E52+F52 -> 45 | H52: 0.66 | I52: 0 | J52: hnìdá
A53: 43. | B53: ocásek | C53: ema kobesová | D53: 23 | E53: 10 | F53: 10 | G53: =D53+E53+F53 -> 43 | H53: 0.33 | I53: 0 | J53: modro-èervená
A54: 44. | B54: kudla | C54: vilík faist | D54: 17 | E54: 10 | F54: 10 | G54: 37 | H54: 0.33 | I54: 0 | J54: èerná
A55: 45. | B55: liák | C55: imon janouek | D55: 33 | E55: 0 | F55: 0 | G55: =D55+E55+F55 -> 33 | H55: 0.66 | I55: 0 | J55: hnìdá
A56: 46. | B56: sirka | C56: ondra zahradník | D56: 30 | E56: 0 | F56: 0 | G56: 30 | H56: 0.66 | I56: 0 | J56: èerná
A57: 47. | B57: øízek | C57: lubo chamrad | D57: 18 | E57: 0 | F57: 0 | G57: =D57+E57+F57 -> 18 | H57: 0.33 | I57: 0 | J57: hnìdá
A58: 48. | B58: mike | C58: jan miksan | D58: 11 | E58: 0 | F58: 0 | G58: 11 | H58: 0.33 | I58: 0 | J58: èerná
A59: 49. | B59: perníèek | C59: honza zadák | D59: 10 | E59: 0 | F59: 0 | G59: =D59+E59+F59 -> 10 | H59: 0.33 | I59: 0 | J59: hnìdá
A60: 50.-51 | B60: kiki | C60: kristýna tomáková | D60: 3 | E60: 0 | F60: 0 | G60: =D60+E60+F60 -> 3 | H60: 0 | I60: 0 | J60: modro-èervená
A61: 50.-51 | B61: vèela | C61: kristýna gothardová | D61: 3 | E61: 0 | F61: 0 | G61: =D61+E61+F61 -> 3 | H61: 0 | I61: 0 | J61: modro-èervená
A62: 52.-53 | B62: viki | C62: viktoria budzyn | D62: -3 | E62: 0 | F62: 0 | G62: =D62+E62+F62 -> -3 | H62: 0 | I62: 0 | J62: modro-èervená
A63: 52.-53 | B63: viktor | D63: -3 | E63: 0 | F63: 0 | G63: =D63+E63+F63 -> -3 | H63: 1 | I63: 0 | J63: zelená