B1: bodování øíjen
B3: do bodování za øíjen e zapoèteno: (celkem mono získat 270 b)
B4: : schùzky PO (celkem 4 schùzky, jedna 25% ) maximálnì 100b.
B5: : schùzky ST (celkem 3 schùzky, jedna 33% ) --> pøepoèteno na 4 schùzky maximálnì 100b
B6: : oddílovka 9.10- + pøespání (+navíc-závody)+ podzimky --> (podzimky 50%, oddílovka 25%, pøespání 25%)
A8: poøadí | B8: pøezdívka | C8: jméno pøíjmení | D8: schùzky | E8: oddílovka | F8: závody | G8: výprava | H8: podzimky | I8: CELKEM | J8: docházka.schùzky | K8: docházka oddíl.+výpravy | L8: estka | M8: odmìnové body
A9: 1 | B9: myka | C9: andrea varcová | D9: 97 | E9: 31 | F9: 35 | G9: 40 | H9: 54 | I9: =H9+G9+F9+E9+D9 -> 257 | J9: 1 | K9: 1 | L9: fialová | M9: 14
A10: 2 | B10: copánek | C10: mariana ïárková | D10: 80 | E10: 31 | F10: 35 | G10: 42 | H10: 53 | I10: =H10+G10+F10+E10+D10 -> 241 | J10: 1 | K10: 1 | L10: èervená | M10: 13
A11: 3 | B11: rex | C11: jan jindáèek | D11: 72 | E11: 35 | F11: 35 | G11: 45 | H11: 52 | I11: =H11+G11+F11+E11+D11 -> 239 | J11: 1 | K11: 1 | L11: èerná | M11: 13
A12: 4 | B12: malina | C12: klára spilková | D12: 80 | E12: 31 | F12: 35 | G12: 40 | H12: 49 | I12: =H12+G12+F12+E12+D12 -> 235 | J12: 1 | K12: 1 | L12: modrá | M12: 13
A13: 5 | B13: ségra | C13: markéta roubová | D13: 79 | E13: 25 | F13: 35 | G13: 40 | H13: 55 | I13: =H13+G13+F13+E13+D13 -> 234 | J13: 0.75 | K13: 1 | L13: fialová | M13: 13
A14: 6 | B14: bibi | C14: bára seifertová | D14: 63 | E14: 28 | F14: 35 | G14: 43 | H14: 52 | I14: =H14+G14+F14+E14+D14 -> 221 | J14: 0.66 | K14: 1 | L14: èervená | M14: 12
A15: 7 | B15: Vojta | C15: Vojta suchánek | D15: 81 | E15: 10 | F15: 35 | G15: 42 | H15: 52 | I15: =H15+G15+F15+E15+D15 -> 220 | J15: 1 | K15: 0.75 | L15: zelená | M15: 12
A16: 8 | B16: mrazík | C16: tomá roud | D16: 56 | E16: 28 | F16: 35 | G16: 45 | H16: 49 | I16: =H16+G16+F16+E16+D16 -> 213 | J16: 0.66 | K16: 1 | L16: èerná | M16: 12
A17: 9 | B17: kudla | C17: vilík faist | D17: 49 | E17: 30 | F17: 35 | G17: 43 | H17: 55 | I17: =H17+G17+F17+E17+D17 -> 212 | J17: 1 | K17: 1 | L17: èerná | M17: 13
A18: 10 | B18: lev | C18: Daník Budweiser | D18: 81 | E18: 30 | F18: 0 | G18: 43 | H18: 52 | I18: =H18+G18+F18+E18+D18 -> 206 | J18: 1 | K18: 1 | L18: zelená | M18: 12
A19: 11 | B19: emsí | C19: fanda faist | D19: 43 | E19: 23 | F19: 35 | G19: 43 | H19: 55 | I19: =H19+G19+F19+E19+D19 -> 199 | J19: 1 | K19: 1 | L19: èerná | M19: 13
A20: 12 | B20: bendr | D20: 76 | E20: 27 | F20: 0 | G20: 38 | H20: 51 | I20: =H20+G20+F20+E20+D20 -> 192 | J20: 1 | K20: 1 | L20: èerná | M20: 12
A21: 13.-14 | B21: pikot | C21: matìj smutný | D21: 99 | E21: 30 | F21: 0 | G21: 10 | H21: 52 | I21: =H21+G21+F21+E21+D21 -> 191 | J21: 1 | K21: 0.75 | L21: hnìdá | M21: 13
A22: 13.-14 | B22: kuba- hnízdo | C22: kuba | D22: 81 | E22: 35 | F22: 35 | G22: 40 | H22: 0 | I22: =H22+G22+F22+E22+D22 -> 191 | J22: 1 | K22: 0.5 | L22: èerná | M22: 8
A23: 15 | B23: vlnka | C23: viktorie bechná | D23: 81 | E23: 23 | F23: 0 | G23: 35 | H23: 49 | I23: =H23+G23+F23+E23+D23 -> 188 | J23: 1 | K23: 1 | L23: èervená | M23: 12
A24: 16 | B24: veverka | C24: lenka macháèková | D24: 60 | E24: 35 | F24: 0 | G24: 40 | H24: 52 | I24: =H24+G24+F24+E24+D24 -> 187 | J24: 0.5 | K24: 1 | L24: fialová | M24: 11
A25: 17.-18 | B25: oveèka | C25: berenika bechná | D25: 76 | E25: 30 | F25: 0 | G25: 35 | H25: 45 | I25: =H25+G25+F25+E25+D25 -> 186 | J25: 1 | K25: 1 | L25: modrá | M25: 12
A26: 17.-18 | B26: ocásek | C26: ema kobesová | D26: 73 | E26: 28 | F26: 35 | G26: 40 | H26: 10 | I26: =H26+G26+F26+E26+D26 -> 186 | J26: 1 | K26: 0.5 | L26: modrá | M26: 8
A27: 19 | B27: klítì | C27: jan smitka | D27: 96 | E27: 10 | F27: 35 | G27: 42 | H27: 0 | I27: =H27+G27+F27+E27+D27 -> 183 | J27: 1 | K27: 0.25 | L27: hnìdá | M27: 9
A28: 20 | B28: hruka | C28: mía kaderová | D28: 60 | E28: 35 | F28: 35 | G28: 42 | H28: 10 | I28: =H28+G28+F28+E28+D28 -> 182 | J28: 0.66 | K28: 0.5 | L28: modrá | M28: 7
A29: 21 | B29: brzda | C29: adam kobes | D29: 70 | E29: 30 | F29: 35 | G29: 43 | H29: 0 | I29: =H29+G29+F29+E29+D29 -> 178 | J29: 1 | K29: 0.5 | L29: èerná | M29: 8
A30: 22 | B30: ika | C30: hana trambová | D30: 59 | E30: 28 | F30: 35 | G30: 43 | H30: 10 | I30: =H30+G30+F30+E30+D30 -> 175 | J30: 0.66 | K30: 0.5 | L30: èervená | M30: 7
A31: 23 | B31: tygøík | C31: linda fryèová | D31: 52 | E31: 28 | F31: 35 | G31: 45 | H31: 10 | I31: =H31+G31+F31+E31+D31 -> 170 | J31: 0.66 | K31: 0.5 | L31: modrá | M31: 7
A32: 24.-25 | B32: vèela | C32: kristýna gothardová | D32: 48 | E32: 35 | F32: 35 | G32: 40 | H32: 10 | I32: =H32+G32+F32+E32+D32 -> 168 | J32: 0.66 | K32: 0.5 | L32: modrá | M32: 7
A33: 24.-25 | B33: Èaryzárd | C33: marek jando | D33: 84 | E33: 10 | F33: 35 | G33: 39 | H33: 0 | I33: =H33+G33+F33+E33+D33 -> 168 | J33: 1 | K33: 0.25 | L33: zelená | M33: 7
A34: 26 | B34: nanuk | C34: jan kotrlík | D34: 95 | E34: 26 | F34: 0 | G34: 43 | H34: 0 | I34: =H34+G34+F34+E34+D34 -> 164 | J34: 1 | K34: 0.5 | L34: hnìdá | M34: 8
A35: 27 | B35: tìnì | C35: adélka domanská | D35: 63 | E35: 10 | F35: 35 | G35: 45 | H35: 10 | I35: =H35+G35+F35+E35+D35 -> 163 | J35: 0.66 | K35: 0.25 | L35: modrá | M35: 6
A36: 28.-29 | B36: lízátko | C36: dianka maruincová | D36: 78 | E36: 30 | F36: 0 | G36: 40 | H36: 10 | I36: =H36+G36+F36+E36+D36 -> 158 | J36: 1 | K36: 0.5 | L36: modrá | M36: 7
A37: 28.-29 | B37: kachnièka | C37: valinka maruincová | D37: 74 | E37: 30 | F37: 0 | G37: 44 | H37: 10 | I37: =H37+G37+F37+E37+D37 -> 158 | J37: 1 | K37: 0.5 | L37: èervená | M37: 7
A38: 30 | B38: rychlík | C38: Matìj Spìváèek | D38: 84 | E38: 30 | F38: 0 | G38: 41 | H38: 0 | I38: =H38+G38+F38+E38+D38 -> 155 | J38: 1 | K38: 0.5 | L38: zelená | M38: 7
A39: 31 | B39: Èimèár | C39: vojta kostifál | D39: 92 | E39: 0 | F39: 0 | G39: 44 | H39: 10 | I39: =H39+G39+F39+E39+D39 -> 146 | J39: 1 | K39: 0.25 | L39: zelená | M39: 6
A40: 32 | B40: krokodýl | C40: vojta janda | D40: 75 | E40: 28 | F40: 0 | G40: 40 | H40: 0 | I40: =H40+G40+F40+E40+D40 -> 143 | J40: 0.75 | K40: 0.5 | L40: hnìdá | M40: 7
A41: 33 | B41: vlk | C41: imon kurz | D41: 75 | E41: 10 | F41: 0 | G41: 45 | H41: 10 | I41: =H41+G41+F41+E41+D41 -> 140 | J41: 0.75 | K41: 0.25 | L41: hnìdá | M41: 12
A42: 34 | B42: liák | C42: imon janouek | D42: 77 | E42: 0 | F42: 0 | G42: 10 | H42: 52 | I42: =H42+G42+F42+E42+D42 -> 139 | J42: 0.75 | K42: 0.5 | L42: hnìdá | M42: 11
A43: 35 | B43: mike | C43: jan miksan | D43: 59 | E43: 28 | F43: 35 | G43: 0 | H43: 10 | I43: =H43+G43+F43+E43+D43 -> 132 | J43: 0.66 | K43: 0.25 | L43: èerná | M43: 4
A44: 36 | B44: motýlek | C44: terezka roschová | D44: 66 | E44: 10 | F44: 0 | G44: 37 | H44: 10 | I44: =H44+G44+F44+E44+D44 -> 123 | J44: 0.75 | K44: 0.25 | L44: fialová | M44: 6
A45: 37 | B45: beruka | C45: kateøina habanská | D45: 66 | E45: 10 | F45: 0 | G45: 35 | H45: 10 | I45: =H45+G45+F45+E45+D45 -> 121 | J45: 0.75 | K45: 0.25 | L45: fialová | M45: 6
A46: 38 | B46: býk | C46: jirka leák | D46: 73 | E46: 0 | F46: 0 | G46: 45 | H46: 0 | I46: =H46+G46+F46+E46+D46 -> 118 | J46: 0.75 | K46: 0.25 | L46: hnìdá | M46: 6
A47: 39 | B47: kiki | C47: kristýna tomáková | D47: 38 | E47: 31 | F47: 0 | G47: 40 | H47: 0 | I47: =H47+G47+F47+E47+D47 -> 109 | J47: 0.5 | K47: 0.5 | L47: fialová | M47: 6
A48: 40 | B48: Honzík | D48: 61 | E48: 0 | F48: 0 | G48: 43 | H48: 0 | I48: =H48+G48+F48+E48+D48 -> 104 | J48: 0.66 | K48: 0.25 | L48: zelená | M48: 5
A49: 41.-42 | B49: mici | C49: patricie dolanská | D49: 58 | E49: 10 | F49: 0 | G49: 10 | H49: 10 | I49: =H49+G49+F49+E49+D49 -> 88 | J49: 0.5 | K49: 0 | L49: fialová | M49: 2
A50: 41.-42 | B50: jetìrka | C50: martina vojtová | D50: 58 | E50: 10 | F50: 0 | G50: 10 | H50: 10 | I50: =H50+G50+F50+E50+D50 -> 88 | J50: 0.5 | K50: 0 | L50: fialová | M50: 2
A51: 43 | B51: rùièka | C51: veronika aichengrová | D51: 56 | E51: 10 | F51: 0 | G51: 10 | H51: 10 | I51: =H51+G51+F51+E51+D51 -> 86 | J51: 0.5 | K51: 0 | L51: fialová | M51: 2
A52: 44 | B52: Luká | C52: Luká Fariz | D52: 34 | E52: 10 | F52: 0 | G52: 41 | H52: 0 | I52: =H52+G52+F52+E52+D52 -> 85 | J52: 0.66 | K52: 0.25 | L52: zelená | M52: 5
A53: 45.-46 | B53: sirka | C53: ondra zahradník | D53: 67 | E53: 0 | F53: 0 | G53: 0 | H53: 0 | I53: =H53+G53+F53+E53+D53 -> 67 | J53: 1 | K53: 0 | L53: èerná | M53: 3
A54: 45.-46 | B54: høíbì | D54: 37 | E54: 10 | F54: 0 | G54: 10 | H54: 10 | I54: =H54+G54+F54+E54+D54 -> 67 | J54: 0.25 | K54: 0 | L54: fialová | M54: 1
A55: 47 | B55: viktor | D55: 52 | E55: 0 | F55: 0 | G55: 10 | H55: 0 | I55: =H55+G55+F55+E55+D55 -> 62 | J55: 0.66 | K55: 0 | L55: zelená | M55: 2
A56: 48 | B56: riki | C56: nina petkinsová | D56: 49 | E56: 0 | F56: 0 | G56: 0 | H56: 10 | I56: =H56+G56+F56+E56+D56 -> 59 | J56: 0.66 | K56: 0 | L56: modrá | M56: 2
A57: 49 | B57: kytièka | C57: elika ptáková | D57: 43 | E57: 0 | F57: 0 | G57: 0 | H57: 10 | I57: =H57+G57+F57+E57+D57 -> 53 | J57: 0.66 | K57: 0 | L57: èervená | M57: 2
A58: 50.-51 | B58: vlkodlak | C58: jan mráz | D58: 0 | E58: 0 | F58: 0 | G58: 45 | H58: 0 | I58: =H58+G58+F58+E58+D58 -> 45 | J58: 0 | K58: 0.25 | L58: hnìdá | M58: 3
A59: 50.-51 | B59: ondra | C59: ondra pták | D59: 45 | E59: 0 | F59: 0 | G59: 0 | H59: 0 | I59: =H59+G59+F59+E59+D59 -> 45 | J59: 0.66 | K59: 0 | L59: zelená | M59: 2
A60: 52 | B60: koèièka | C60: bára | D60: 25 | E60: 0 | F60: 0 | G60: 0 | H60: 10 | I60: =H60+G60+F60+E60+D60 -> 35 | J60: 0.33 | K60: 0 | L60: èervená | M60: 1
A61: 53.-56 | B61: dan | C61: dan hrubý | D61: 0 | E61: 0 | F61: 0 | G61: 0 | H61: 0 | I61: =H61+G61+F61+E61+D61 -> 0 | J61: 0 | K61: 0 | L61: hnìdá | M61: 0
A62: 53.-56 | B62: david | C62: david | D62: 0 | E62: 0 | F62: 0 | G62: 0 | H62: 0 | I62: =H62+G62+F62+E62+D62 -> 0 | J62: 0 | K62: 0 | L62: hnìdá | M62: 0
A63: 53.-56 | B63: øízek | C63: lubo chamrad | D63: 0 | E63: 0 | F63: 0 | G63: 0 | H63: 0 | I63: =H63+G63+F63+E63+D63 -> 0 | J63: 0 | K63: 0 | L63: hnìdá | M63: 0
A64: 53.-56 | B64: perníèek | C64: honza zadák | D64: 0 | E64: 0 | F64: 0 | G64: 0 | H64: 0 | I64: =H64+G64+F64+E64+D64 -> 0 | J64: 0 | K64: 0 | L64: hnìdá | M64: 0