B1: bodování prosinec
B3: do bodování za prosinec je zapoèteno: (celkem mono získat 120 b)
B4: : schùzky maximálnì 75 b.
B5: : vánoèní výprava maximálnì 45 b.
B7: pøezdívka | C7: jméno pøíjmení | D7: schùzky | E7: vánoce | F7: CELKEM | G7: docházka oddíl.+výpravy | H7: docházka schùzky | I7: estka | J7: odmìnové body (max.6)
A8: 1 | B8: myka | C8: andrea varcová | D8: 71 | E8: 45 | F8: =D8+E8 -> 116 | G8: 1 | H8: 1 | I8: fialová | J8: 6
A9: 2 | B9: malina | C9: klára spilková | D9: 69 | E9: 45 | F9: =D9+E9 -> 114 | G9: 100 | H9: 1 | I9: modrá | J9: 6
A10: 2.-3 | B10: Èaryzárd | C10: marek jando | D10: 69 | E10: 45 | F10: =D10+E10 -> 114 | G10: 1 | H10: 1 | I10: zelená | J10: 6
A11: 2.-3 | B11: lev | C11: Daník Budweiser | D11: 68 | E11: 45 | F11: =D11+E11 -> 113 | G11: 1 | H11: 1 | I11: zelená | J11: 6
A12: 4 | B12: hruka | C12: mía kaderová | D12: 64 | E12: 45 | F12: =D12+E12 -> 109 | G12: 1 | H12: 1 | I12: modrá | J12: 6
A13: 5 | B13: mrazík | C13: tomá roud | D13: 63 | E13: 45 | F13: =D13+E13 -> 108 | G13: 1 | H13: 1 | I13: èerná | J13: 6
A14: 6 | B14: rychlík | C14: Matìj Spìváèek | D14: 72 | E14: 35 | F14: =D14+E14 -> 107 | G14: 1 | H14: 1 | I14: zelená | J14: 6
A15: 7.-8 | B15: bibi | C15: bára seifertová | D15: 60 | E15: 45 | F15: =D15+E15 -> 105 | G15: 1 | H15: 1 | I15: èervená | J15: 6
A16: 7.-8 | B16: ségra | C16: markéta roubová | D16: 70 | E16: 35 | F16: =D16+E16 -> 105 | G16: 1 | H16: 1 | I16: fialová | J16: 6
A17: 9 | B17: brzda | C17: adam kobes | D17: 59 | E17: 45 | F17: =D17+E17 -> 104 | G17: 1 | H17: 1 | I17: èerná | J17: 6
A18: 10 | B18: Vojta | C18: Vojta suchánek | D18: 54.5 | E18: 45 | F18: 100 | G18: 1 | H18: 1 | I18: zelená | J18: 6
A19: 11 | B19: copánek | C19: mariana ïárková | D19: 54 | E19: 45 | F19: =D19+E19 -> 99 | G19: 1 | H19: 1 | I19: èervená | J19: 4
A20: 12 | B20: veverka | C20: lenka macháèková | D20: 52 | E20: 45 | F20: =D20+E20 -> 97 | G20: 0.66 | H20: 1 | I20: fialová | J20: 5
A21: 13 | B21: krokodýl | C21: vojta janda | D21: 61 | E21: 35 | F21: =D21+E21 -> 96 | G21: 1 | H21: 1 | I21: hnìdá | J21: 6
A22: 14 | B22: pikot | C22: matìj smutný | D22: 50 | E22: 45 | F22: =D22+E22 -> 95 | G22: 0.66 | H22: 1 | I22: hnìdá | J22: 5
A23: 15 | B23: vlk | C23: imon kurz | D23: 58 | E23: 35 | F23: =D23+E23 -> 93 | G23: 1 | H23: 1 | I23: hnìdá | J23: 6
A24: 16 | B24: bendr | C24: luká vraný | D24: 42 | E24: 45 | F24: =D24+E24 -> 87 | G24: 0.66 | H24: 1 | I24: èerná | J24: 5
A25: 17.-18 | B25: kuba- hnízdo | C25: kuba | D25: 40 | E25: 45 | F25: =D25+E25 -> 85 | G25: 0.66 | H25: 1 | I25: èerná | J25: 5
A26: 17.-18 | B26: vèela | C26: kristýna gothardová | D26: 40 | E26: 45 | F26: =D26+E26 -> 85 | G26: 0.66 | H26: 1 | I26: modrá | J26: 5
A27: 19 | B27: Èimèár | C27: vojta kostifál | D27: 49 | E27: 35 | F27: =D27+E27 -> 84 | G27: 0.66 | H27: 1 | I27: zelená | J27: 5
A28: 20 | B28: ocásek | C28: ema kobesová | D28: 27 | E28: 45 | F28: =D28+E28 -> 72 | G28: 0.33 | H28: 1 | I28: modrá | J28: 4
A29: 21 | B29: emsí | C29: fanda faist | D29: 25 | E29: 45 | F29: =D29+E29 -> 70 | G29: 0.66 | H29: 1 | I29: èerná | J29: 5
A30: 22.-23 | B30: mici | C30: patricie dolanská | D30: 69 | E30: 0 | F30: =D30+E30 -> 69 | G30: 1 | H30: 0 | I30: fialová | J30: 3
A31: 22.-23 | B31: lízátko | C31: dianka maruincová | D31: 34 | E31: 35 | F31: =D31+E31 -> 69 | G31: 0.33 | H31: 1 | I31: modrá | J31: 4
A32: 24.-25 | B32: nanuk | C32: jan kotrlík | D32: 31 | E32: 35 | F32: =D32+E32 -> 66 | G32: 0.33 | H32: 1 | I32: hnìdá | J32: 4
A33: 24.-25 | B33: ondra | C33: ondra pták | D33: 66 | E33: 0 | F33: =D33+E33 -> 66 | G33: 1 | H33: 0 | I33: zelená | J33: 3
A34: 26.-27 | B34: tìnì | C34: adélka domanská | D34: 28 | E34: 35 | F34: =D34+E34 -> 63 | G34: 0.33 | H34: 1 | I34: modrá | J34: 4
A35: 26.-27 | B35: riki | C35: nina petkinsová | D35: 18 | E35: 45 | F35: =D35+E35 -> 63 | G35: 0.33 | H35: 1 | I35: modrá | J35: 4
A36: 28 | B36: kudla | C36: vilík faist | D36: 16 | E36: 45 | F36: =D36+E36 -> 61 | G36: 0.33 | H36: 1 | I36: èerná | J36: 4
A37: 29 | B37: liák | C37: imon janouek | D37: 15 | E37: 45 | F37: =D37+E37 -> 60 | G37: 0 | H37: 1 | I37: hnìdá | J37: 3
A38: 30 | B38: høíbì | C38: adéla buková | D38: 14 | E38: 45 | F38: =D38+E38 -> 59 | G38: 0.33 | H38: 1 | I38: fialová | J38: 4
A39: 31 | B39: rex | C39: jan jindáèek | D39: 46 | E39: 10 | F39: =D39+E39 -> 56 | G39: 0.66 | H39: 0 | I39: èerná | J39: 2
A40: 32.-33 | B40: kytièka | C40: elika ptáková | D40: 55 | E40: 0 | F40: =D40+E40 -> 55 | G40: 1 | H40: 0 | I40: èervená | J40: 3
A41: 32.-33 | B41: koèièka | C41: bára | D41: 55 | E41: 0 | F41: =D41+E41 -> 55 | G41: 1 | H41: 0 | I41: èervená | J41: 3
A42: 34 | B42: Honzík | D42: 54.5 | E42: 0 | F42: 54 | G42: 1 | H42: 0 | I42: zelená | J42: 3
A43: 35.-36 | B43: rùièka | C43: veronika aichengrová | D43: 53 | E43: 0 | F43: =D43+E43 -> 53 | G43: 0.66 | H43: 0 | I43: fialová | J43: 2
A44: 35.-36 | B44: tygøík | C44: linda fryèová | D44: 53 | E44: 0 | F44: =D44+E44 -> 53 | G44: 0.66 | H44: 0 | I44: modrá | J44: 2
A45: 37 | B45: viktor | D45: 15 | E45: 35 | F45: =D45+E45 -> 50 | G45: 0 | H45: 1 | I45: zelená | J45: 3
A46: 38 | B46: kachnièka | C46: valinka maruincová | D46: 34 | E46: 10 | F46: =D46+E46 -> 44 | G46: 0.33 | H46: 1 | I46: èervená | J46: 1
A47: 39 | B47: jetìrka | C47: martina vojtová | D47: 39 | E47: 0 | F47: =D47+E47 -> 39 | G47: 0.66 | H47: 0 | I47: fialová | J47: 2
A48: 40 | B48: Luká | C48: Luká Fariz | D48: -3 | E48: 35 | F48: =D48+E48 -> 32 | G48: 0 | H48: 1 | I48: zelená | J48: 3
A49: 41 | B49: ika | C49: hana trambová | D49: 30 | E49: 0 | F49: =D49+E49 -> 30 | G49: 0.33 | H49: 0 | I49: èervená | J49: 1
A50: 42 | B50: klítì | C50: jan smitka | D50: 15 | E50: 10 | F50: =D50+E50 -> 25 | G50: 0 | H50: 0 | I50: hnìdá | J50: 0
A51: 43 | B51: sirka | C51: ondra zahradník | D51: 16 | E51: 0 | F51: =D51+E51 -> 16 | G51: 0.33 | H51: 0 | I51: èerná | J51: 1
A52: 44.-45 | B52: vlnka | C52: viktorie bechná | D52: 9 | E52: 0 | F52: =D52+E52 -> 9 | G52: 0 | H52: 0 | I52: èervená | J52: 0
A53: 44.-45 | B53: oveèka | C53: berenika bechná | D53: 9 | E53: 0 | F53: =D53+E53 -> 9 | G53: 0 | H53: 0 | I53: modrá | J53: 0
A54: 46.-49 | B54: mike | C54: jan miksan | D54: -3 | E54: 0 | F54: =D54+E54 -> -3 | G54: 0 | H54: 0 | I54: èerná | J54: 0
A55: 46.-49 | B55: kiki | C55: kristýna tomáková | D55: -3 | E55: 0 | F55: =D55+E55 -> -3 | G55: 0 | H55: 0 | I55: fialová | J55: 0
A56: 46.-49 | B56: motýlek | C56: terezka roschová | D56: -3 | E56: 0 | F56: =D56+E56 -> -3 | G56: 0 | H56: 0 | I56: fialová | J56: 0