B1: bodování bøezen
D3: celkem mono získat 240 b
B4: : schùzky maximálnì 125 b. (1sch.=20%)
E5: : oddílovka max. 35 b (25%)
E6: : makarní max. 35b (25%)
E7: : výprava holky/ kluci max. 45 b (50%)
B9: pøezdívka | C9: jméno pøíjmení | D9: schùzky | E9: oddílovka | F9: makarní | G9: výprava | H9: CELKEM | I9: docházka schùzky | J9: docházka výprava | K9: estka | L9: odmìnové body (max.11)
A10: 1. | B10: mici | C10: patricie dolanská | D10: 115 | E10: 30 | F10: 35 | G10: 43 | H10: =D10+E10+F10+G10 -> 223 | I10: 1 | J10: 1 | K10: fialová | L10: 11
A11: 2. | B11: rychlík | C11: Matìj Spìváèek | D11: 114 | E11: 30 | F11: 35 | G11: 43 | H11: =D11+E11+F11+G11 -> 222 | I11: 1 | J11: 1 | K11: zelená | L11: 11
A12: 3. | B12: rùièka | C12: veronika aichengrová | D12: 110 | E12: 30 | F12: 35 | G12: 45 | H12: =D12+E12+F12+G12 -> 220 | I12: 1 | J12: 1 | K12: fialová | L12: 11
A13: 4. | B13: bibi | C13: bára seifertová | D13: 106 | E13: 30 | F13: 35 | G13: 43 | H13: =D13+E13+F13+G13 -> 214 | I13: 1 | J13: 1 | K13: èervená | L13: 11
A14: 5. | B14: ocásek | C14: ema kobesová | D14: 97 | E14: 30 | F14: 35 | G14: 41 | H14: =D14+E14+F14+G14 -> 203 | I14: 1 | J14: 1 | K14: modrá | L14: 11
A15: 6. | B15: pikot | C15: matìj smutný | D15: 106 | E15: 10 | F15: 35 | G15: 43 | H15: =D15+E15+F15+G15 -> 194 | I15: 1 | J15: 0.75 | K15: hnìdá | L15: 10
A16: 7. | B16: lev | C16: Daník Budweiser | D16: 115 | E16: 30 | F16: 35 | G16: 10 | H16: =D16+E16+F16+G16 -> 190 | I16: 1 | J16: 0.5 | K16: zelená | L16: 8
A17: 8. | B17: Tarzan | C17: Luká Fariz | D17: 110 | E17: 0 | F17: 35 | G17: 43 | H17: =D17+E17+F17+G17 -> 188 | I17: 1 | J17: 0.75 | K17: zelená | L17: 10
A18: 9. | B18: copánek | C18: mariana ïárková | D18: 104 | E18: 30 | F18: 0 | G18: 45 | H18: =D18+E18+F18+G18 -> 179 | I18: 1 | J18: 0.75 | K18: èervená | L18: 9
A19: 10. | B19: rex | C19: jan jindáèek | D19: 65 | E19: 30 | F19: 35 | G19: 43 | H19: =D19+E19+F19+G19 -> 173 | I19: 0.8 | J19: 1 | K19: èerná | L19: 10
A20: 11.-12 | B20: hruka | C20: mía kaderová | D20: 91 | E20: 30 | F20: 35 | G20: 10 | H20: =D20+E20+F20+G20 -> 166 | I20: 0.8 | J20: 0.5 | K20: modrá | L20: 8
A21: 11.-12 | B21: lízátko | C21: dianka maruincová | D21: 91 | E21: 30 | F21: 35 | G21: 10 | H21: =D21+E21+F21+G21 -> 166 | I21: 0.8 | J21: 0.5 | K21: modrá | L21: 8
A22: 13. | B22: liák | C22: imon janouek | D22: 100 | E22: 30 | F22: 35 | G22: 0 | H22: =D22+E22+F22+G22 -> 165 | I22: 1 | J22: 0.5 | K22: hnìdá | L22: 8
A23: 14. | B23: malina | C23: klára spilková | D23: 87 | E23: 30 | F23: 35 | G23: 10 | H23: =D23+E23+F23+G23 -> 162 | I23: 0.8 | J23: 0.5 | K23: modrá | L23: 7
A24: 15. | B24: Èaryzárd | C24: marek jando | D24: 118 | E24: 0 | F24: 0 | G24: 43 | H24: =D24+E24+F24+G24 -> 161 | I24: 1 | J24: 0.5 | K24: zelená | L24: 8
A25: 16. | B25: Vojta | C25: Vojta suchánek | D25: 82 | E25: 0 | F25: 35 | G25: 43 | H25: =D25+E25+F25+G25 -> 160 | I25: 0.8 | J25: 0.75 | K25: zelená | L25: 9
A26: 17. | B26: kachnièka | C26: valinka maruincová | D26: 82 | E26: 30 | F26: 35 | G26: 10 | H26: =D26+E26+F26+G26 -> 157 | I26: 0.8 | J26: 0.5 | K26: èervená | L26: 7
A27: 18. | B27: Èimèár | C27: vojta kostifál | D27: 100 | E27: 30 | F27: 10 | G27: 10 | H27: =D27+E27+F27+G27 -> 150 | I27: 0.8 | J27: 0.25 | K27: zelená | L27: 5
A28: 19. | B28: Honzík | D28: 106 | E28: 0 | F28: 0 | G28: 43 | H28: =D28+E28+F28+G28 -> 149 | I28: 1 | J28: 0.5 | K28: zelená | L28: 8
A29: 20. | B29: brzda | C29: adam kobes | D29: 66 | E29: 30 | F29: 0 | G29: 43 | H29: =D29+E29+F29+G29 -> 139 | I29: 1 | J29: 0.75 | K29: èerná | L29: 9
A30: 21. | B30: kiki | C30: kristýna tomáková | D30: 57 | E30: 0 | F30: 35 | G30: 41 | H30: =D30+E30+F30+G30 -> 133 | I30: 0.6 | J30: 0.75 | K30: fialová | L30: 8
A31: 22. | B31: mrazík | C31: tomá roud | D31: 67 | E31: 30 | F31: 35 | G31: 0 | H31: =D31+E31+F31+G31 -> 132 | I31: 0.8 | J31: 0.5 | K31: èerná | L31: 7
A32: 23. | B32: krokodýl | C32: vojta janda | D32: 89 | E32: 30 | F32: 0 | G32: 10 | H32: =D32+E32+F32+G32 -> 129 | I32: 0.8 | J32: 0.25 | K32: hnìdá | L32: 5
A33: 24. | B33: kuba- hnízdo | C33: kuba | D33: 75 | E33: 0 | F33: 10 | G33: 43 | H33: =D33+E33+F33+G33 -> 128 | I33: 1 | J33: 0.5 | K33: èerná | L33: 8
A34: 25. | B34: veverka | C34: lenka macháèková | D34: 111 | E34: 0 | F34: 0 | G34: 10 | H34: =D34+E34+F34+G34 -> 121 | I34: 1 | J34: 0 | K34: fialová | L34: 5
A35: 26. | B35: klítì | C35: jan smitka | D35: 72 | E35: 10 | F35: 35 | G35: 0 | H35: =D35+E35+F35+G35 -> 117 | I35: 0.6 | J35: 0.25 | K35: hnìdá | L35: 5
A36: 27. | B36: tìnì | C36: adélka domanská | D36: 58 | E36: 10 | F36: 35 | G36: 10 | H36: =D36+E36+F36+G36 -> 113 | I36: 0.4 | J36: 0.25 | K36: modrá | L36: 4
A37: 28. | B37: sirka | C37: ondra zahradník | D37: 75 | E37: 0 | F37: 35 | G37: 0 | H37: =D37+E37+F37+G37 -> 110 | I37: 1 | J37: 0.25 | K37: èerná | L37: 7
A38: 29. | B38: vlk | C38: imon kurz | D38: 105 | E38: 0 | F38: 0 | G38: 0 | H38: =D38+E38+F38+G38 -> 105 | I38: 1 | J38: 0 | K38: hnìdá | L38: 5
A39: 30. | B39: ika | C39: hana trambová | D39: 74 | E39: 10 | F39: 10 | G39: 10 | H39: =D39+E39+F39+G39 -> 104 | I39: 0.6 | J39: 0 | K39: èervená | L39: 3
A40: 31. | B40: kudla | C40: vilík faist | D40: 54 | E40: 0 | F40: 0 | G40: 43 | H40: =D40+E40+F40+G40 -> 97 | I40: 1 | J40: 0.5 | K40: èerná | L40: 8
A41: 32. | B41: jetìrka | C41: martina vojtová | D41: 34 | E41: 10 | F41: 10 | G41: 39 | H41: =D41+E41+F41+G41 -> 93 | I41: 0.2 | J41: 0.5 | K41: fialová | L41: 4
A42: 33.-34 | B42: emsí | C42: fanda faist | D42: 49 | E42: 0 | F42: 0 | G42: 43 | H42: =D42+E42+F42+G42 -> 92 | I42: 1 | J42: 0.5 | K42: èerná | L42: 8
A43: 33.-34 | B43: viktor | D43: 92 | E43: 0 | F43: 0 | G43: 0 | H43: =D43+E43+F43+G43 -> 92 | I43: 0.8 | J43: 0 | K43: zelená | L43: 4
A44: 35. | B44: ondra | C44: ondra pták | D44: 40 | E44: 0 | F44: 35 | G44: 10 | H44: =D44+E44+F44+G44 -> 85 | I44: 0.2 | J44: 0.25 | K44: zelená | L44: 3
A45: 36.-37 | B45: kytièka | C45: elika ptáková | D45: 34 | E45: 0 | F45: 35 | G45: 10 | H45: =D45+E45+F45+G45 -> 79 | I45: 0.2 | J45: 0.25 | K45: èervená | L45: 3
A46: 36.-37 | B46: koèièka | C46: bára | D46: 34 | E46: 0 | F46: 35 | G46: 10 | H46: =D46+E46+F46+G46 -> 79 | I46: 0.2 | J46: 0.25 | K46: èervená | L46: 3
A47: 38. | B47: Fialka | C47: lucka | D47: 59 | E47: 0 | F47: 0 | G47: 0 | H47: =D47+E47+F47+G47 -> 59 | I47: 1 | J47: 0 | K47: modrá | L47: 3
A48: 39. | B48: bendr | C48: luká vraný | D48: 20 | E48: 0 | F48: 0 | G48: 0 | H48: =D48+E48+F48+G48 -> 20 | I48: 0 | J48: 0 | K48: èerná | L48: 0
A49: 40. | B49: myka | C49: andrea varcová | D49: 0 | E49: 0 | F49: 0 | G49: 0 | H49: =D49+E49+F49+G49 -> 0 | I49: 0 | J49: 0 | K49: fialová | L49: 0