B1: docházka záøí -prosinec
B3: v tabulkách je pøehlednì uvedeno, kolika akcí z kolika možných se dítì úèastnilo
B4: souèet bodù by mìl být minimánì 12
B5: smajlíci zhodnocují docházku Dobrá/ Horší èi Špatná
B6: tábor: | C6: na tábor pojedou jen dìti s dobrou docházkou, mají- li v obou pololetích usmìváèka
C7: pokud, má vaše dítì mraèouna, ale uvidíme, že svou docházku zlepší, na tábor mùže jet
B9: jaká by mìla být docházka
B10: mladší vlèata a svìtlušky (1. – 2. tøída): úèast na oddílovkách a schùzkách alespoò 65 %,
G11: úèast na výpravách alespoò 50%
H12: úèast na vícedenní výpravì (podzimky, vánoce, velikonoce)
B13: starší vlèata a svìtlušky (3.-5. tøída): úèast na oddílovkách a schùzkách 70 %
F14: úèast na výpravách 55 %
F15: úèast na podzimkách nebo velikonocích
C17: SCHÙZKY | D17: ODDÍLOVKY | E17: VÝPRAVY
C18: Pondìlní 14, | H18: souèet
C19: Støedeèní 13 | D19: celkem 5 | E19: celkem 5 | F19: Podzimky | H19: z 24/23 | I19: Rada jak se zlepšit
B20: rex | C20: 9 | D20: 3 | E20: 4 | F20: P | G20: J | H20: =C20+D20+E20 -> 16
B21: hnízdo | C21: 10 | D21: 5 | E21: 2 | G21: J | H21: =C21+D21+E21 -> 17 | I21: pøidej ve výpravách
B22: mrazík | C22: 11 | D22: 5 | E22: 4 | F22: P | G22: J | H22: =C22+D22+E22 -> 20 | I22: J
B23: emsí | C23: 8 | D23: 5 | E23: 4 | G23: J | H23: =C23+D23+E23 -> 17 | I23: pøidej ve schùzkách
B24: kudla | C24: 6 | D24: 3 | E24: 3 | G24: L | H24: =C24+D24+E24 -> 12 | I24: pøidej
B25: brzda | C25: 12 | D25: 4 | E25: 3 | G25: J | H25: =C25+D25+E25 -> 19 | I25: J
B26: sirka | C26: 8 | D26: 2 | E26: 0 | G26: L | H26: =C26+D26+E26 -> 10 | I26: zaèni jezdit na výpravy!
B27: bendr | C27: 5 | D27: 2 | E27: 3 | F27: P | G27: L | H27: =C27+D27+E27 -> 10 | I27: pøidej hlavnì ve schùzkách
B28: mikeš | C28: 4 | D28: 1 | E28: 0 | G28: L | H28: =C28+D28+E28 -> 5 | I28: zaèni chodit na akce!
B30: motýlek | C30: 7 | D30: 3 | E30: 2 | G30: K | H30: =C30+D30+E30 -> 12 | I30: pøidej ve schùzkách a oddílovách
B31: myška | C31: 11 | D31: 5 | E31: 3 | G31: J | H31: =C31+D31+E31 -> 19 | I31: J
B32: veverka | C32: 7 | D32: 2 | E32: 3 | G32: K | H32: =C32+D32+E32 -> 12 | I32: pøidej ve schùzkách a oddílovách
B33: mici | C33: 11 | D33: 3 | E33: 1 | G33: J | H33: =C33+D33+E33 -> 15 | I33: pøidej ve výpravách
B34: rùžièka | C34: 10 | D34: 3 | E34: 1 | G34: J | H34: =C34+D34+E34 -> 14 | I34: pøidej ve výpravách
B35: ségra | C35: 7 | D35: 4 | E35: 3 | F35: P | G35: J | H35: =C35+D35+E35 -> 14 | I35: pøidej ve schùzkách
B36: ještìrka | C36: 7 | D36: 0 | E36: 0 | G36: L | H36: =C36+D36+E36 -> 7 | I36: pøijï na oddílovku a výpravu
B37: høíbì | C37: 6 | D37: 2 | E37: 1 | G37: L | H37: =C37+D37+E37 -> 9 | I37: pøidej
B38: kiki | C38: 3 | D38: 2 | E38: 1 | G38: L | H38: =C38+D38+E38 -> 6 | I38: zaèni chodit na akce!
B40: piškot | C40: 12 | D40: 4 | E40: 4 | F40: P | G40: J | H40: =C40+D40+E40 -> 20 | I40: J
B41: klíštì | C41: 10 | D41: 4 | E41: 2 | G41: J | H41: =C41+D41+E41 -> 16 | I41: pøidej ve výpravách
B42: krokodýl | C42: 12 | D42: 4 | E42: 3 | G42: J | H42: =C42+D42+E42 -> 19 | I42: J
B43: nanuk | C43: 10 | D43: 4 | E43: 2 | G43: J | H43: =C43+D43+E43 -> 16 | I43: pøidej ve výpravách
B44: vlk | C44: 13 | D44: 1 | E44: 2 | G44: J | H44: =C44+D44+E44 -> 16 | I44: pøidej v oddílovkách a výpravách
B45: lišák | C45: 5 | D45: 1 | E45: 2 | F45: P | G45: L | H45: =C45+D45+E45 -> 8 | I45: pøidej
B47: štìnì | C47: 8 | D47: 4 | E47: 3 | G47: J | H47: =C47+D47+E47 -> 15 | I47: pøidej ve schùzkách
B48: lízátko | C48: 9 | D48: 2 | E48: 4 | G48: J | H48: =C48+D48+E48 -> 15 | I48: pøidej ve schùzkách a oddílovách
B49: hruška | C49: 12 | D49: 5 | E49: 4 | G49: J | H49: =C49+D49+E49 -> 21 | I49: J
B50: malina | C50: 12 | D50: 5 | E50: 4 | F50: P | G50: J | H50: =C50+D50+E50 -> 21 | I50: J
B51: riki | C51: 8 | D51: 2 | E51: 2 | G51: J | H51: =C51+D51+E51 -> 12 | I51: pøidej ve schùzkách a oddílovách
B52: oveèka | C52: 6 | D52: 1 | E52: 2 | F52: P | G52: L | H52: =C52+D52+E52 -> 9 | I52: pøidej
B53: vèela | C53: 8 | D53: 2 | E53: 2 | G53: J | H53: =C53+D53+E53 -> 12 | I53: pøidej ve schùzkách a oddílovách
B54: ocásek | C54: 8 | D54: 4 | E54: 2 | G54: J | H54: =C54+D54+E54 -> 14 | I54: pøidej ve výpravách
B55: tygøík | C55: 10 | D55: 3 | E55: 1 | G55: J | H55: =C55+D55+E55 -> 14 | I55: pøidej ve výpravách
B57: copánek | C57: 12 | D57: 5 | E57: 5 | F57: P | G57: J | H57: =C57+D57+E57 -> 22 | I57: J
B58: šiška | C58: 9 | D58: 3 | E58: 2 | G58: J | H58: =C58+D58+E58 -> 14 | I58: pøidej v oddílovkách a výpravách
B59: bibi | C59: 12 | D59: 5 | E59: 5 | F59: P | G59: J | H59: =C59+D59+E59 -> 22 | I59: J
B60: kytièka | C60: 8 | D60: 0 | E60: 0 | G60: L | H60: =C60+D60+E60 -> 8 | I60: pøidej v oddílovkách a výpravách
B61: kachnièka | C61: 8 | D61: 4 | E61: 3 | G61: J | H61: =C61+D61+E61 -> 15 | I61: pøidej ve schùzkách
B62: vlnka | C62: 7 | D62: 1 | E62: 2 | F62: P | G62: L | H62: =C62+D62+E62 -> 10 | I62: pøidej
B63: koèièka | C63: 5 | D63: 0 | E63: 0 | G63: L | H63: =C63+D63+E63 -> 5 | I63: pøidej v oddílovkách a výpravách
B65: lev | C65: 11 | D65: 4 | E65: 4 | F65: P | G65: J | H65: =C65+D65+E65 -> 19 | I65: J
B66: Èaryzárd | C66: 11 | D66: 4 | E66: 3 | G66: J | H66: =C66+D66+E66 -> 18 | I66: J
B67: Vojta | C67: 11 | D67: 2 | E67: 5 | F67: P | G67: J | H67: =C67+D67+E67 -> 18 | I67: J
B68: Èimèár | C68: 11 | D68: 3 | E68: 3 | G68: J | H68: =C68+D68+E68 -> 17 | I68: pøidej v oddílovkách a výpravách
B69: Lukáš | C69: 5 | D69: 0 | E69: 2 | G69: L | H69: =C69+D69+E69 -> 7 | I69: pøidej
B70: rychlík | C70: 13 | D70: 4 | E70: 4 | G70: J | H70: =C70+D70+E70 -> 21 | I70: J
B71: Honzík | C71: 8 | D71: 0 | E71: 1 | G71: L | H71: =C71+D71+E71 -> 9 | I71: pøidej v oddílovkách a výpravách
B72: viktor | C72: 5 | D72: 0 | E72: 1 | G72: L | H72: =C72+D72+E72 -> 6 | I72: pøidej
B73: ondra | C73: 5 | D73: 0 | E73: 0 | G73: L | H73: =C73+D73+E73 -> 5 | I73: pøidej