B1: bodování leden
D3: celkem mono získat 170 b
B4: : schùzky maximálnì 100 b.
D5: : oddílovka maximálnì 35 b (50%)
B6: : výprava maximálnì 35 b. (50%)
B8: pøezdívka | C8: jméno pøíjmení | D8: schùzky | E8: oddílovka | F8: kino | G8: CELKEM | H8: docházka oddíl.+výpravy | I8: docházka.schùzky | J8: estka | K8: odmìnové body (max.7)
A9: 1 | B9: lev | C9: Daník Budweiser | D9: 95 | E9: 26 | F9: 30 | G9: =D9+E9+F9 -> 151 | H9: 1 | I9: 1 | J9: zelená | K9: 7
A10: 2 | B10: pikot | C10: matìj smutný | D10: 84 | E10: 34 | F10: 30 | G10: =D10+E10+F10 -> 148 | H10: 1 | I10: 1 | J10: hnìdá | K10: 7
A11: 3 | B11: mrazík | C11: tomá roud | D11: 86 | E11: 30 | F11: 30 | G11: =D11+E11+F11 -> 146 | H11: 1 | I11: 1 | J11: èerná | K11: 7
A12: 4 | B12: rex | C12: jan jindáèek | D12: 80 | E12: 32 | F12: 30 | G12: =D12+E12+F12 -> 142 | H12: 1 | I12: 1 | J12: èerná | K12: 7
A13: 5 | B13: Èimèár | C13: vojta kostifál | D13: 98 | E13: 31 | F13: 10 | G13: =D13+E13+F13 -> 139 | H13: 1 | I13: 0.5 | J13: zelená | K13: 5
A14: 6.-7 | B14: malina | C14: klára spilková | D14: 90 | E14: 32 | F14: 10 | G14: =D14+E14+F14 -> 132 | H14: 100 | I14: 0.5 | J14: modrá | K14: 5
A15: 6.-7 | B15: ocásek | C15: ema kobesová | D15: 90 | E15: 32 | F15: 10 | G15: =D15+E15+F15 -> 132 | H15: 1 | I15: 0.5 | J15: modrá | K15: 5
A16: 8 | B16: rychlík | C16: Matìj Spìváèek | D16: 73 | E16: 28 | F16: 30 | G16: =D16+E16+F16 -> 131 | H16: 0.75 | I16: 1 | J16: zelená | K16: 6
A17: 9 | B17: bibi | C17: bára seifertová | D17: 63 | E17: 33 | F17: 30 | G17: =D17+E17+F17 -> 126 | H17: 0.75 | I17: 1 | J17: èervená | K17: 6
A18: 10 | B18: veverka | C18: lenka macháèková | D18: 86 | E18: 28 | F18: 10 | G18: =D18+E18+F18 -> 124 | H18: 1 | I18: 0.5 | J18: fialová | K18: 5
A19: 11 | B19: kuba- hnízdo | C19: kuba | D19: 80 | E19: 33 | F19: 10 | G19: =D19+E19+F19 -> 123 | H19: 1 | I19: 0.5 | J19: èerná | K19: 5
A20: 12 | B20: Èaryzárd | C20: marek jando | D20: 77 | E20: 31 | F20: 10 | G20: =D20+E20+F20 -> 118 | H20: 0.75 | I20: 0.5 | J20: zelená | K20: 4
A21: 13.-14 | B21: hruka | C21: mía kaderová | D21: 74 | E21: 33 | F21: 10 | G21: 116 | H21: 0.75 | I21: 0.5 | J21: modrá | K21: 4
A22: 13.-14 | B22: myka | C22: andrea varcová | D22: 52 | E22: 34 | F22: 30 | G22: =D22+E22+F22 -> 116 | H22: 0.5 | I22: 1 | J22: fialová | K22: 5
A23: 15 | B23: Vojta | C23: Vojta suchánek | D23: 84 | E23: 32 | F23: 0 | G23: 115 | H23: 1 | I23: 0.5 | J23: zelená | K23: 5
A24: 16 | B24: brzda | C24: adam kobes | D24: 73 | E24: 32 | F24: 10 | G24: 1114 | H24: 1 | I24: 0.5 | J24: èerná | K24: 5
A25: 17 | B25: lízátko | C25: dianka maruincová | D25: 43 | E25: 34 | F25: 30 | G25: =D25+E25+F25 -> 107 | H25: 0.5 | I25: 1 | J25: modrá | K25: 5
A26: 18.-19 | B26: kudla | C26: vilík faist | D26: 44 | E26: 32 | F26: 30 | G26: =D26+E26+F26 -> 106 | H26: 1 | I26: 1 | J26: èerná | K26: 7
A27: 18.-19 | B27: sirka | C27: ondra zahradník | D27: 72 | E27: 34 | F27: 0 | G27: =D27+E27+F27 -> 106 | H27: 1 | I27: 0.5 | J27: èerná | K27: 5
A28: 20 | B28: liák | C28: imon janouek | D28: 63 | E28: 26 | F28: 10 | G28: =D28+E28+F28 -> 99 | H28: 0.75 | I28: 0.5 | J28: hnìdá | K28: 4
A29: 21 | B29: bendr | C29: luká vraný | D29: 75 | E29: 10 | F29: 10 | G29: 96 | H29: 1 | I29: 0 | J29: èerná | K29: 4
A30: 22.-23 | B30: rùièka | C30: veronika aichengrová | D30: 53 | E30: 32 | F30: 10 | G30: =D30+E30+F30 -> 95 | H30: 0.5 | I30: 0.5 | J30: fialová | K30: 3
A31: 22.-23 | B31: copánek | C31: mariana ïárková | D31: 51 | E31: 33 | F31: 10 | G31: 95 | H31: 0.5 | I31: 0.5 | J31: èervená | K31: 3
A32: 24 | B32: emsí | C32: fanda faist | D32: 29 | E32: 32 | F32: 30 | G32: 94 | H32: 1 | I32: 1 | J32: èerná | K32: 7
A33: 25 | B33: mici | C33: patricie dolanská | D33: 70 | E33: 10 | F33: 10 | G33: =D33+E33+F33 -> 90 | H33: 0.75 | I33: 0 | J33: fialová | K33: 3
A34: 26 | B34: krokodýl | C34: vojta janda | D34: 67 | E34: 10 | F34: 10 | G34: =D34+E34+F34 -> 87 | H34: 0.75 | I34: 0 | J34: hnìdá | K34: 3
A35: 27.-28 | B35: kachnièka | C35: valinka maruincová | D35: 27 | E35: 27 | F35: 30 | G35: =D35+E35+F35 -> 84 | H35: 0.25 | I35: 1 | J35: èervená | K35: 4
A36: 27.-28 | B36: vlk | C36: imon kurz | D36: 84 | E36: 0 | F36: 0 | G36: =D36+E36+F36 -> 84 | H36: 1 | I36: 0 | J36: hnìdá | K36: 4
A37: 29 | B37: jetìrka | C37: martina vojtová | D37: 52 | E37: 31 | F37: 0 | G37: =D37+E37+F37 -> 83 | H37: 0.75 | I37: 0 | J37: fialová | K37: 4
A38: 30 | B38: Luká | C38: Luká Fariz | D38: 73 | E38: 0 | F38: 0 | G38: =D38+E38+F38 -> 73 | H38: 0.75 | I38: 0 | J38: zelená | K38: 3
A39: 31 | B39: ika | C39: hana trambová | D39: 67 | E39: 0 | F39: 0 | G39: =D39+E39+F39 -> 67 | H39: 0.75 | I39: 0 | J39: èervená | K39: 3
A40: 32 | B40: kiki | C40: kristýna tomáková | D40: 54 | E40: 0 | F40: 0 | G40: =D40+E40+F40 -> 54 | H40: 0.75 | I40: 0.5 | J40: fialová | K40: 3
A41: 33.-34 | B41: klítì | C41: jan smitka | D41: 50 | E41: 0 | F41: 0 | G41: =D41+E41+F41 -> 50 | H41: 0.5 | I41: 0 | J41: hnìdá | K41: 2
A42: 33.-34 | B42: viktor | D42: 50 | E42: 0 | F42: 0 | G42: =D42+E42+F42 -> 50 | H42: 0.5 | I42: 0 | J42: zelená | K42: 2
A43: 35 | B43: ondra | C43: ondra pták | D43: 34 | E43: 0 | F43: 0 | G43: =D43+E43+F43 -> 34 | H43: 0.5 | I43: 0 | J43: zelená | K43: 2
A44: 36.-37 | B44: kytièka | C44: elika ptáková | D44: 15 | E44: 0 | F44: 0 | G44: =D44+E44+F44 -> 15 | H44: 0.25 | I44: 0 | J44: èervená | K44: 1
A45: 36.-37 | B45: koèièka | C45: bára | D45: 15 | E45: 0 | F45: 0 | G45: =D45+E45+F45 -> 15 | H45: 0.25 | I45: 0 | J45: èervená | K45: 1
A46: 38 | B46: tìnì | C46: adélka domanská | D46: -3 | E46: 0 | F46: 0 | G46: =D46+E46+F46 -> -3 | H46: 0 | I46: 0 | J46: modrá | K46: 1