A1: ODMÌNOVÉ BODY
A2: NA CO JSOU? Dìti sbírají celý rok odmìnové body (za vechny skautské akce)
A3: Ti nejlepí, pojedou na výpravu za odmìnu (aquapark, lanové centrum, )
A4: Body budou slouit také jako "mìøidlo" k tomu, které dìti pojedou na tábor
A6: Schùzka, oddílovka 1 bod
A7: výprava jednodenní 2 body
A8: výprava 2-3 denní 3 body
A9: výprava vícedenní 5 bodù
B11: záøí (max. 6b) | C11: øíjen (max. 14b) | D11: listopad (max.9b) | E11: prosinec (max. 6b) | F11: celkem Záøí- Prosinec (max. 35b) | H11: leden | I11: únor | J11: bøezen | K11: duben | L11: kvìten
A12: rex | B12: 2 | C12: 13 | D12: 5 | E12: 2 | F12: =B12+C12+D12+E12 -> 22
A13: kuba- hnízdo | B13: 4 | C13: 8 | D13: 4 | E13: 5 | F13: =B13+C13+D13+E13 -> 21
A14: mrazík | B14: 3 | C14: 12 | D14: 9 | E14: 6 | F14: =B14+C14+D14+E14 -> 30
A15: emsí | B15: 4 | C15: 13 | D15: 3 | E15: 5 | F15: =B15+C15+D15+E15 -> 25
A16: brzda | B16: 2 | C16: 8 | D16: 7 | E16: 6 | F16: =B16+C16+D16+E16 -> 23
A17: kudla | B17: 1 | C17: 13 | D17: 2 | E17: 4 | F17: =B17+C17+D17+E17 -> 20
A18: sirka | B18: 2 | C18: 3 | D18: 4 | E18: 1 | F18: =B18+C18+D18+E18 -> 10
A19: bendr | B19: 0 | C19: 12 | D19: 2 | E19: 5 | F19: =B19+C19+D19+E19 -> 19
A20: mike | B20: 1 | C20: 4 | D20: 3 | E20: 0 | F20: =B20+C20+D20+E20 -> 8
A21: motýlek | B21: 5 | C21: 6 | D21: 3 | E21: 0 | F21: =B21+C21+D21+E21 -> 14
A22: veverka | B22: 4 | C22: 11 | D22: 3 | E22: 5 | F22: =B22+C22+D22+E22 -> 23
A23: myka | B23: 3 | C23: 14 | D23: 6 | E23: 6 | F23: =B23+C23+D23+E23 -> 29
A24: mici | B24: 3 | C24: 2 | D24: 9 | E24: 3 | F24: =B24+C24+D24+E24 -> 17
A25: rùièka | B25: 3 | C25: 2 | D25: 8 | E25: 2 | F25: =B25+C25+D25+E25 -> 15
A26: ségra | B26: 3 | C26: 13 | D26: 4 | E26: 6 | F26: =B26+C26+D26+E26 -> 26
A27: jetìrka | B27: 3 | C27: 2 | D27: 2 | E27: 2 | F27: =B27+C27+D27+E27 -> 9
A28: høíbì | B28: 2 | C28: 1 | D28: 4 | E28: 4 | F28: =B28+C28+D28+E28 -> 11
A29: kiki | B29: 0 | C29: 6 | D29: 2 | E29: 0 | F29: =B29+C29+D29+E29 -> 8
A30: pikot | B30: 6 | C30: 10 | D30: 9 | E30: 5 | F30: =B30+C30+D30+E30 -> 30
A31: klítì | B31: 5 | C31: 7 | D31: 3 | E31: 0 | F31: =B31+C31+D31+E31 -> 15
A32: krokodýl | B32: 5 | C32: 7 | D32: 6 | E32: 6 | F32: =B32+C32+D32+E32 -> 24
A33: nanuk | B33: 3 | C33: 8 | D33: 5 | E33: 4 | F33: =B33+C33+D33+E33 -> 20
A34: vlk | B34: 4 | C34: 6 | D34: 5 | E34: 6 | F34: =B34+C34+D34+E34 -> 21
A35: liák | B35: 2 | C35: 8 | D35: 2 | E35: 3 | F35: =B35+C35+D35+E35 -> 15
A36: tìnì | B36: 6 | C36: 6 | D36: 4 | E36: 4 | F36: =B36+C36+D36+E36 -> 20
A37: lízátko | B37: 6 | C37: 7 | D37: 5 | E37: 5 | F37: =B37+C37+D37+E37 -> 23
A38: hruka | B38: 6 | C38: 7 | D38: 9 | E38: 6 | F38: =B38+C38+D38+E38 -> 28
A39: malina | B39: 4 | C39: 13 | D39: 8 | E39: 6 | F39: =B39+C39+D39+E39 -> 31
A40: riki | B40: 5 | C40: 2 | D40: 5 | E40: 4 | F40: =B40+C40+D40+E40 -> 16
A41: oveèka | B41: 2 | C41: 12 | D41: 1 | E41: 0 | F41: =B41+C41+D41+E41 -> 15
A42: vèela | B42: 0 | C42: 7 | D42: 2 | E42: 5 | F42: =B42+C42+D42+E42 -> 14
A43: ocásek | B43: 1 | C43: 8 | D43: 2 | E43: 4 | F43: =B43+C43+D43+E43 -> 15
A44: tygøík | B44: 3 | C44: 7 | D44: 1 | E44: 2 | F44: =B44+C44+D44+E44 -> 13
A45: copánek | B45: 6 | C45: 13 | D45: 8 | E45: 4 | F45: =B45+C45+D45+E45 -> 31
A46: ika | B46: 6 | C46: 7 | D46: 2 | E46: 1 | F46: =B46+C46+D46+E46 -> 16
A47: bibi | B47: 6 | C47: 12 | D47: 9 | E47: 6 | F47: =B47+C47+D47+E47 -> 33
A48: kytièka | B48: 0 | C48: 2 | D48: 3 | E48: 3 | F48: =B48+C48+D48+E48 -> 8
A49: kachnièka | B49: 6 | C49: 7 | D49: 6 | E49: 1 | F49: =B49+C49+D49+E49 -> 20
A50: vlnka | B50: 2 | C50: 12 | D50: 1 | E50: 0 | F50: =B50+C50+D50+E50 -> 15
A51: koèièka | B51: 0 | C51: 1 | D51: 1 | E51: 3 | F51: =B51+C51+D51+E51 -> 5
A52: lev | B52: 6 | C52: 12 | D52: 5 | E52: 6 | F52: =B52+C52+D52+E52 -> 29
A53: Èaryzárd | B53: 6 | C53: 7 | D53: 5 | E53: 6 | F53: =B53+C53+D53+E53 -> 24
A54: Vojta | B54: 6 | C54: 12 | D54: 6 | E54: 6 | F54: =B54+C54+D54+E54 -> 30
A55: Èimèár | B55: 6 | C55: 6 | D55: 5 | E55: 5 | F55: =B55+C55+D55+E55 -> 22
A56: Luká | B56: 3 | C56: 5 | D56: 0 | E56: 3 | F56: =B56+C56+D56+E56 -> 11
A57: rychlík | B57: 6 | C57: 7 | D57: 8 | E57: 6 | F57: =B57+C57+D57+E57 -> 27
A58: Honzík | B58: 3 | C58: 5 | D58: 1 | E58: 3 | F58: =B58+C58+D58+E58 -> 12
A59: viktor | B59: 3 | C59: 2 | D59: 2 | E59: 3 | F59: =B59+C59+D59+E59 -> 10
A60: ondra | B60: 0 | C60: 2 | D60: 3 | E60: 3 | F60: =B60+C60+D60+E60 -> 8