B1: bodování únor
D3: celkem možno získat 130 b
B4: : schùzky maximálnì 75 b.
E5: : pololetky max. 55b
B7: pøezdívka | C7: jméno pøíjmení | D7: schùzky | E7: pololetky | F7: CELKEM | G7: docházka schùzky | H7: docházka výprava | I7: šestka | J7: odmìnové body (max.8)
A8: 1. | B8: lev | C8: Daník Budweiser | D8: 71 | E8: 55 | F8: =D8+E8 -> 126 | G8: 1 | H8: 1 | I8: zelená | J8: 8
A9: 2. | B9: copánek | C9: mariana žïárková | D9: 67 | E9: 55 | F9: =D9+E9 -> 122 | G9: 1 | H9: 1 | I9: èervená | J9: 8
A10: 3. | B10: bibi | C10: bára seifertová | D10: 63 | E10: 55 | F10: =D10+E10 -> 118 | G10: 1 | H10: 1 | I10: èervená | J10: 8
A11: 4. | B11: piškot | C11: matìj smutný | D11: 60 | E11: 55 | F11: =D11+E11 -> 115 | G11: 1 | H11: 1 | I11: hnìdá | J11: 8
A12: 5. | B12: krokodýl | C12: vojta janda | D12: 61 | E12: 50 | F12: =D12+E12 -> 111 | G12: 1 | H12: 1 | I12: hnìdá | J12: 8
A13: 6. | B13: brzda | C13: adam kobes | D13: 56 | E13: 50 | F13: =D13+E13 -> 106 | G13: 1 | H13: 1 | I13: èerná | J13: 8
A14: 7. | B14: bendr | C14: lukáš vraný | D14: 44 | E14: 55 | F14: =D14+E14 -> 99 | G14: 0.66 | H14: 1 | I14: èerná | J14: 7
A15: 8. | B15: emsí | C15: fanda faist | D15: 30 | E15: 55 | F15: =D15+E15 -> 85 | G15: 1 | H15: 1 | I15: èerná | J15: 8
A16: 9. | B16: ocásek | C16: ema kobesová | D16: 33 | E16: 50 | F16: =D16+E16 -> 83 | G16: 0.66 | H16: 1 | I16: modrá | J16: 7
A17: 10. | B17: mici | C17: patricie dolanská | D17: 70 | E17: 10 | F17: =D17+E17 -> 80 | G17: 1 | H17: 0 | I17: fialová | J17: 3
A18: 11. | B18: myška | C18: andrea švarcová | D18: 66 | E18: 10 | F18: =D18+E18 -> 76 | G18: 1 | H18: 0 | I18: fialová | J18: 3
A19: 12. | B19: mrazík | C19: tomáš roud | D19: 62 | E19: 10 | F19: =D19+E19 -> 72 | G19: 1 | H19: 0 | I19: èerná | J19: 3
A20: 13. | B20: Lukáš | C20: Lukáš Fariz | D20: 71 | E20: 0 | F20: =D20+E20 -> 71 | G20: 1 | H20: 0 | I20: zelená | J20: 3
A21: 14. | B21: kuba- hnízdo | C21: kuba | D21: 57 | E21: 10 | F21: =D21+E21 -> 67 | G21: 1 | H21: 0 | I21: èerná | J21: 3
A22: 15. | B22: rex | C22: jan jindáèek | D22: 66 | E22: 0 | F22: =D22+E22 -> 66 | G22: 1 | H22: 0 | I22: èerná | J22: 3
A23: 16. | B23: Èaryzárd | C23: marek jandoš | D23: 54 | E23: 10 | F23: =D23+E23 -> 64 | G23: 0.66 | H23: 0 | I23: zelená | J23: 2
A24: 17.-18. | B24: malina | C24: klára spilková | D24: 50 | E24: 10 | F24: =D24+E24 -> 60 | G24: 0.66 | H24: 0 | I24: modrá | J24: 2
A25: 17.-18. | B25: Èimèár | C25: vojta kostifál | D25: 50 | E25: 10 | F25: =D25+E25 -> 60 | G25: 0.66 | H25: 0 | I25: zelená | J25: 2
A26: 19. | B26: sirka | C26: ondra zahradník | D26: 58 | E26: 0 | F26: =D26+E26 -> 58 | G26: 1 | H26: 0 | I26: èerná | J26: 3
A27: 20. | B27: ondra | C27: ondra pták | D27: 55 | E27: 0 | F27: =D27+E27 -> 55 | G27: 1 | H27: 0 | I27: zelená | J27: 3
A28: 21. | B28: lišák | C28: šimon janoušek | D28: 29 | E28: 25 | F28: =D28+E28 -> 54 | G28: 0.33 | H28: 1 | I28: hnìdá | J28: 6
A29: 22. | B29: štìnì | C29: adélka domanská | D29: 50 | E29: 0 | F29: =D29+E29 -> 50 | G29: 0.66 | H29: 0 | I29: modrá | J29: 2
A30: 23.-24. | B30: kytièka | C30: eliška ptáková | D30: 48 | E30: 0 | F30: =D30+E30 -> 48 | G30: 1 | H30: 0 | I30: èervená | J30: 3
A31: 23.-24. | B31: Honzík | D31: 48 | E31: 0 | F31: =D31+E31 -> 48 | G31: 0.66 | H31: 0 | I31: zelená | J31: 2
A32: 25. | B32: koèièka | C32: bára | D32: 47 | E32: 0 | F32: =D32+E32 -> 47 | G32: 1 | H32: 0 | I32: èervená | J32: 3
A33: 26. | B33: rùžièka | C33: veronika aichengrová | D33: 35 | E33: 10 | F33: =D33+E33 -> 45 | G33: 0.33 | H33: 0 | I33: fialová | J33: 1
A34: 27. | B34: veverka | C34: lenka macháèková | D34: 33 | E34: 10 | F34: =D34+E34 -> 43 | G34: 0.33 | H34: 0 | I34: fialová | J34: 1
A35: 28. | B35: kudla | C35: vilík faist | D35: 32 | E35: 10 | F35: =D35+E35 -> 42 | G35: 1 | H35: 0 | I35: èerná | J35: 3
A36: 29.-31. | B36: šiška | C36: hana trambová | D36: 31 | E36: 10 | F36: =D36+E36 -> 41 | G36: 0.33 | H36: 0 | I36: èervená | J36: 1
A37: 29.-31. | B37: klíštì | C37: jan smitka | D37: 41 | E37: 0 | F37: =D37+E37 -> 41 | G37: 0.66 | H37: 0 | I37: hnìdá | J37: 2
A38: 29.-31. | B38: rychlík | C38: Matìj Spìváèek | D38: 31 | E38: 10 | F38: =D38+E38 -> 41 | G38: 0.33 | H38: 0 | I38: zelená | J38: 1
A39: 32. | B39: hruška | C39: míša kaderová | D39: 30 | E39: 10 | F39: =D39+E39 -> 40 | G39: 0.33 | H39: 0 | I39: modrá | J39: 1
A40: 33. | B40: ještìrka | C40: martina vojtová | D40: 27 | E40: 10 | F40: =D40+E40 -> 37 | G40: 0.33 | H40: 0 | I40: fialová | J40: 1
A41: 34. | B41: viktor | D41: 33 | E41: 0 | F41: =D41+E41 -> 33 | G41: 0.66 | H41: 0 | I41: zelená | J41: 2
A42: 35. | B42: vlk | C42: šimon kurz | D42: 30 | E42: 0 | F42: =D42+E42 -> 30 | G42: 0.33 | H42: 0 | I42: hnìdá | J42: 1
A43: 36. | B43: Vojta | C43: Vojta suchánek | D43: 27 | E43: 0 | F43: =D43+E43 -> 27 | G43: 0.33 | H43: 0 | I43: zelená | J43: 1
A44: 37. | B44: lízátko | C44: dianka marušincová | D44: 15 | E44: 10 | F44: =D44+E44 -> 25 | G44: 0 | H44: 0 | I44: modrá | J44: 0
A45: 38. | B45: kachnièka | C45: valinka marušincová | D45: 3 | E45: 10 | F45: =D45+E45 -> 13 | G45: 0.33 | H45: 0 | I45: èervená | J45: 1
A46: 39. | B46: kiki | C46: kristýna tomášková | D46: -3 | E46: 0 | F46: =D46+E46 -> -3 | G46: 0 | H46: 0 | I46: fialová | J46: 0